<?xml version="1.0" encoding="utf-8" ?>
<!DOCTYPE scany PUBLIC "-//JHLabs.org//DTD scany 1.0//EN"
                           "./dtd/scany-2.0.dtd">

<scany>

	<local>
		<schema></schema>
		<directory></directory>
		<characterEncoding>utf-8</characterEncoding>
		<spooling>
			<directory></directory>
		</spooling>
	</local>

	<client>
		<http>
			<characterEncoding>utf-8</characterEncoding>
			<url>http://</url>
			<message format="json">
				<keysign encryption="none">1234</keysign>
				<body compressable="true"/>
			</message>
		</http>
	</client>

	<server>
		<remote>
			<connection>
				<host port=""/>
				<timeout>2000</timeout>
			</connection>
			<message format="xml">
				<keysign encryption="none">1234</keysign>
				<body compressable="true"/>
			</message>
		</remote>
		<optimizing>
			
		</optimizing>
	</server>

</scany>
